{"schema_version":"secure-bench-adapted-report-v1","scanner_version":"1.22.0","adapter_version":"1.0.0","raw_sha256":"fd82bfa6f7a0c3ec59e0f01764c5436534892cfb440d3eba4dcfc9b05452d9a2","raw_size_bytes":1013,"findings":[{"finding_id":"233c4e7f8e7ad63c7183017fe939661a09a1760c654729a8dba4e0134b93b266","projection_fingerprint":"fde57c0ec10886317204bebd0b4136e8b3567252bb6a2e716d322049e5d11813","duplicate_of":null,"rule_id":"secure-bench.phase19.SE1004.path-traversal","primary_location":{"path":"entry.js","start_line":17,"start_column":3,"end_line":17,"end_column":40,"start_offset":{"availability":"available","value":721},"end_offset":{"availability":"available","value":758}},"message":{"availability":"available","value":"Request-controlled path reaches a filesystem read without canonical confinement."},"severity":{"availability":"available","value":"ERROR"},"scanner_fingerprint":{"availability":"available","value":"e071c56bb289d76b7083d5c022a8334ffad5b72e0e7c96babea4ed7c7c5e36511201610c3af2aa701f88dd7a79663babea4d73bd3596cef71b7163a6d1770783_0"},"rule_metadata":{},"evidence":{"source_identity":{"availability":"unavailable","reason":"unavailable: opengrep-json-v1 does not declare this Evidence Contract v2 field"},"sink_identity":{"availability":"unavailable","reason":"unavailable: opengrep-json-v1 does not declare this Evidence Contract v2 field"},"evidence_path":{"availability":"unavailable","reason":"unavailable: opengrep-json-v1 does not declare this Evidence Contract v2 field"},"guards":{"availability":"unavailable","reason":"unavailable: opengrep-json-v1 does not declare this Evidence Contract v2 field"},"cwe":{"availability":"unavailable","reason":"unavailable: opengrep-json-v1 does not declare this Evidence Contract v2 field"},"taxonomy":{"availability":"unavailable","reason":"unavailable: opengrep-json-v1 does not declare this Evidence Contract v2 field"},"confidence":{"availability":"unavailable","reason":"unavailable: opengrep-json-v1 does not declare this Evidence Contract v2 field"}}}]}
