{"schema_version":"secure-bench-adapted-report-v1","scanner_version":"1.22.0","adapter_version":"1.0.0","raw_sha256":"87608c2116d43c61634852d66b1bd0d2566d798b3028ce0cefaab75e26a2a742","raw_size_bytes":961,"findings":[{"finding_id":"0c1aaa1fe03fec504c846373bafb7b2c1194a3f74875f5986ef96190003b1c9c","projection_fingerprint":"f7d302e27eb2a10a7ab27171beea5cd0e288d1c7008941293136e1a0527c76c3","duplicate_of":null,"rule_id":"secure-bench.phase19.SE1005.outbound-request","primary_location":{"path":"entry.ts","start_line":16,"start_column":3,"end_line":16,"end_column":27,"start_offset":{"availability":"available","value":637},"end_offset":{"availability":"available","value":661}},"message":{"availability":"available","value":"Request-controlled destination reaches an outbound request."},"severity":{"availability":"available","value":"ERROR"},"scanner_fingerprint":{"availability":"available","value":"8ddfe4c62baea5155512aa8d113372ff5266909e48cbaa61359736b6910479e6c596bca57691bde9d18c9ec53b791e11396f237edea8d78c820db3b93168a0aa_0"},"rule_metadata":{},"evidence":{"source_identity":{"availability":"unavailable","reason":"unavailable: opengrep-json-v1 does not declare this Evidence Contract v2 field"},"sink_identity":{"availability":"unavailable","reason":"unavailable: opengrep-json-v1 does not declare this Evidence Contract v2 field"},"evidence_path":{"availability":"unavailable","reason":"unavailable: opengrep-json-v1 does not declare this Evidence Contract v2 field"},"guards":{"availability":"unavailable","reason":"unavailable: opengrep-json-v1 does not declare this Evidence Contract v2 field"},"cwe":{"availability":"unavailable","reason":"unavailable: opengrep-json-v1 does not declare this Evidence Contract v2 field"},"taxonomy":{"availability":"unavailable","reason":"unavailable: opengrep-json-v1 does not declare this Evidence Contract v2 field"},"confidence":{"availability":"unavailable","reason":"unavailable: opengrep-json-v1 does not declare this Evidence Contract v2 field"}}}]}
