{"schema_version":"secure-bench-adapted-report-v1","scanner_version":"1.170.0","adapter_version":"1.0.0","raw_sha256":"cec1da75dd1b823801d90090392d0d7fd145abcabef62f6877be06d60a4433b2","raw_size_bytes":1772,"findings":[{"finding_id":"973f6a2ecdd1f0af151d44ed1d15234408a4fea6bd144544ab0445971c580a98","projection_fingerprint":"83cc26718cb3b1f48c17d95d6d5dc1e04d8e27bba9beaa35fff5324616ad9f50","duplicate_of":null,"rule_id":"secure-bench.phase19.SE1005.outbound-request","primary_location":{"path":"policy.tsx","start_line":4,"start_column":3,"end_line":4,"end_column":27,"start_offset":{"availability":"available","value":246},"end_offset":{"availability":"available","value":270}},"message":{"availability":"available","value":"Request-controlled destination reaches an outbound request."},"severity":{"availability":"available","value":"ERROR"},"scanner_fingerprint":{"availability":"unavailable","reason":"unavailable: Semgrep CE emitted the login-gated fingerprint placeholder"},"rule_metadata":{},"evidence":{"source_identity":{"availability":"unavailable","reason":"unavailable: semgrep-json-v1 does not declare this Evidence Contract v2 field"},"sink_identity":{"availability":"unavailable","reason":"unavailable: semgrep-json-v1 does not declare this Evidence Contract v2 field"},"evidence_path":{"availability":"unavailable","reason":"unavailable: semgrep-json-v1 does not declare this Evidence Contract v2 field"},"guards":{"availability":"unavailable","reason":"unavailable: semgrep-json-v1 does not declare this Evidence Contract v2 field"},"cwe":{"availability":"unavailable","reason":"unavailable: semgrep-json-v1 does not declare this Evidence Contract v2 field"},"taxonomy":{"availability":"unavailable","reason":"unavailable: semgrep-json-v1 does not declare this Evidence Contract v2 field"},"confidence":{"availability":"unavailable","reason":"unavailable: semgrep-json-v1 does not declare this Evidence Contract v2 field"}}}]}
