{"schema_version":"secure-bench-adapted-report-v1","scanner_version":"1.22.0","adapter_version":"1.0.0","raw_sha256":"06edee0703b888f99287de2e0f11c5ae4f372034105982efbb9044fec39e8576","raw_size_bytes":1023,"findings":[{"finding_id":"1ad64b29294e349c8944b59fed326591f05928957024fb83a590e257dcbb8ab2","projection_fingerprint":"b91d4924908c1e8249531b60d5c6e1e0645edc56c255de3ef8aad8295b5c2b1e","duplicate_of":null,"rule_id":"secure-bench.phase19.SE1004.path-traversal","primary_location":{"path":"policy.tsx","start_line":8,"start_column":3,"end_line":8,"end_column":40,"start_offset":{"availability":"available","value":333},"end_offset":{"availability":"available","value":370}},"message":{"availability":"available","value":"Request-controlled path reaches a filesystem read without canonical confinement."},"severity":{"availability":"available","value":"ERROR"},"scanner_fingerprint":{"availability":"available","value":"a15e620361af5de1b056ab2e4ac5edf3e2a03b017ca5a58fa855ac23fa6841d984de52f16069d172b60f6b0fb77c6261e4543d8a9035fc95ddae6151861061c9_0"},"rule_metadata":{},"evidence":{"source_identity":{"availability":"unavailable","reason":"unavailable: opengrep-json-v1 does not declare this Evidence Contract v2 field"},"sink_identity":{"availability":"unavailable","reason":"unavailable: opengrep-json-v1 does not declare this Evidence Contract v2 field"},"evidence_path":{"availability":"unavailable","reason":"unavailable: opengrep-json-v1 does not declare this Evidence Contract v2 field"},"guards":{"availability":"unavailable","reason":"unavailable: opengrep-json-v1 does not declare this Evidence Contract v2 field"},"cwe":{"availability":"unavailable","reason":"unavailable: opengrep-json-v1 does not declare this Evidence Contract v2 field"},"taxonomy":{"availability":"unavailable","reason":"unavailable: opengrep-json-v1 does not declare this Evidence Contract v2 field"},"confidence":{"availability":"unavailable","reason":"unavailable: opengrep-json-v1 does not declare this Evidence Contract v2 field"}}}]}
