{"schema_version":"secure-bench-adapted-report-v1","scanner_version":"1.170.0","adapter_version":"1.0.0","raw_sha256":"7cccbad8b8d49ba86acf8244512b2acde424189110d0f9aa11de9ad5a5c63106","raw_size_bytes":1734,"findings":[{"finding_id":"ccb1a0b05050fe2bcbcc738e66304f7dc6288c914638f9628dc5da8c62247959","projection_fingerprint":"e694c8990f520f0546cc5ad233044a2c1ebaaf7e9d24ec5ef74f5246c541bd43","duplicate_of":null,"rule_id":"secure-bench.phase19.SE1007.sql-injection","primary_location":{"path":"entry.ts","start_line":13,"start_column":3,"end_line":13,"end_column":87,"start_offset":{"availability":"available","value":576},"end_offset":{"availability":"available","value":660}},"message":{"availability":"available","value":"Request-controlled data is concatenated into a SQL query."},"severity":{"availability":"available","value":"ERROR"},"scanner_fingerprint":{"availability":"unavailable","reason":"unavailable: Semgrep CE emitted the login-gated fingerprint placeholder"},"rule_metadata":{},"evidence":{"source_identity":{"availability":"unavailable","reason":"unavailable: semgrep-json-v1 does not declare this Evidence Contract v2 field"},"sink_identity":{"availability":"unavailable","reason":"unavailable: semgrep-json-v1 does not declare this Evidence Contract v2 field"},"evidence_path":{"availability":"unavailable","reason":"unavailable: semgrep-json-v1 does not declare this Evidence Contract v2 field"},"guards":{"availability":"unavailable","reason":"unavailable: semgrep-json-v1 does not declare this Evidence Contract v2 field"},"cwe":{"availability":"unavailable","reason":"unavailable: semgrep-json-v1 does not declare this Evidence Contract v2 field"},"taxonomy":{"availability":"unavailable","reason":"unavailable: semgrep-json-v1 does not declare this Evidence Contract v2 field"},"confidence":{"availability":"unavailable","reason":"unavailable: semgrep-json-v1 does not declare this Evidence Contract v2 field"}}}]}
