{"schema_version":"secure-bench-adapted-report-v1","scanner_version":"1.22.0","adapter_version":"1.0.0","raw_sha256":"5c412462eef2321b66e19642ec1fc4693b64bb3679be083e27c85e3dfd5260a1","raw_size_bytes":1116,"findings":[{"finding_id":"bc7c20c3274d4e69860e9ae19cd432e038bf8fb0eedb4447c75df5f665667450","projection_fingerprint":"c7a2b88ebe9776fc70c5b3678fcb887bcf3e94b7c38f4f6cd7d38182a6a5015d","duplicate_of":null,"rule_id":"secure-bench.phase19.SE1001.resource-authorization","primary_location":{"path":"entry.ts","start_line":19,"start_column":3,"end_line":19,"end_column":65,"start_offset":{"availability":"available","value":650},"end_offset":{"availability":"available","value":712}},"message":{"availability":"available","value":"Protected mutation must be dominated by resource-bound authorization."},"severity":{"availability":"available","value":"ERROR"},"scanner_fingerprint":{"availability":"available","value":"fdd537c1588f6b6a4c73b21480cecd00f2fc8a810d48c65ebc102caa23c204dfbdc624d954c56aaadcb34d67a996d457d8f9ea75553d61b0c98c8eeba36870a6_0"},"rule_metadata":{},"evidence":{"source_identity":{"availability":"unavailable","reason":"unavailable: opengrep-json-v1 does not declare this Evidence Contract v2 field"},"sink_identity":{"availability":"unavailable","reason":"unavailable: opengrep-json-v1 does not declare this Evidence Contract v2 field"},"evidence_path":{"availability":"unavailable","reason":"unavailable: opengrep-json-v1 does not declare this Evidence Contract v2 field"},"guards":{"availability":"unavailable","reason":"unavailable: opengrep-json-v1 does not declare this Evidence Contract v2 field"},"cwe":{"availability":"unavailable","reason":"unavailable: opengrep-json-v1 does not declare this Evidence Contract v2 field"},"taxonomy":{"availability":"unavailable","reason":"unavailable: opengrep-json-v1 does not declare this Evidence Contract v2 field"},"confidence":{"availability":"unavailable","reason":"unavailable: opengrep-json-v1 does not declare this Evidence Contract v2 field"}}}]}
